{
  "schema": 1,
  "phase": "development",
  "id": "tk-capture-1",
  "manifest_sha256": "41432d988f774fa79a0fc6e58bd8de59393d0f4ce1b6a5565ab0aa9534a09f90",
  "product_source_commit": "5c7d1273bc3471136d87f730482e07a679e0e00e",
  "upstream_commit": "117b054598f4758b598f4b8f48feea48c11fe7b0",
  "ledger": {
    "path": "compat/vispy-compatibility.json",
    "sha256": "875c1be945f27398577ef140450b6998fe22713836a9defea2ec57b24fae538d"
  },
  "matrix": {
    "path": "compat/no-opengl-matrix.json",
    "sha256": "9477ee4a888fbe59d85ee09d0fe779de376f73982cdab7aea2447c11b046f410"
  },
  "required_host_rows": [
    "windows-vulkan-headless",
    "windows-vulkan-qwidget-pyqt5",
    "windows-vulkan-qwidget-pyqt6",
    "windows-vulkan-qwidget-pyside6",
    "windows-vulkan-napari-pyqt6",
    "windows-vulkan-glue-vispy-viewers-pyqt6",
    "windows-vulkan-napari-threedee-pyqt6",
    "wsl-linux-lavapipe-x11-headless",
    "wsl-linux-lavapipe-x11-qwidget-pyqt5",
    "wsl-linux-lavapipe-x11-qwidget-pyqt6",
    "wsl-linux-lavapipe-x11-qwidget-pyside6",
    "wsl-linux-lavapipe-x11-napari-pyqt6",
    "wsl-linux-lavapipe-x11-glue-vispy-viewers-pyqt6",
    "wsl-linux-lavapipe-x11-napari-threedee-pyqt6"
  ],
  "runtime_inputs": {
    "path": "compat/candidates/tk-state-resource-1/runtime-inputs.json",
    "sha256": "5287eb42b9c77886e7a73bbe446e157eb3a58f35ce2b07aeea483000e01d0444"
  },
  "profiles": [
    {
      "id": "windows-gpu-tk86-cp312-development",
      "required": true,
      "observation": {
        "path": "compat/candidates/tk-capture-1/windows-capture-profile.json",
        "sha256": "e796e370f5272224353a4c522ca8592b7b1aee3b274e0029ec4d822eeb169c33"
      },
      "wheel": null,
      "previous_qualified_wheel_sha256": "62df5e4c31bf9a1bb1bea47fd68d50e4198d6ec13d2551c991da1e7f30a2b38f",
      "install": [
        "uv",
        "pip",
        "install",
        "--python",
        "{consumer_python}",
        "--no-deps",
        "{wheel}"
      ]
    },
    {
      "id": "wsl-software-tk90-cp31213-development",
      "required": true,
      "observation": {
        "path": "compat/candidates/tk-capture-1/linux-capture-profile.json",
        "sha256": "bcc1f4ba71cd79eb60ee508a5db3622d1d7d22f1870398c442549d34e3495bbe"
      },
      "wheel": null,
      "previous_qualified_wheel_sha256": "374a74ea9787ccccc643e0ac7e45d9f704a41d046465828736158ac94398c4a3",
      "install": [
        "uv",
        "pip",
        "install",
        "--python",
        "{consumer_python}",
        "--no-deps",
        "{wheel}"
      ]
    }
  ],
  "proposals": [
    {
      "id": "tk.readback.crop-formats",
      "entry_points": [
        "gloo.read_pixels"
      ],
      "origins": [
        {
          "feature": "gloo.read-pixels",
          "profile": "unassigned"
        }
      ],
      "upstream_sources": [
        {
          "path": "gloo/wrappers.py",
          "sha256": "73dbb5eb8ca78b2822266d272ffb14db9fcadd7a56512843209187714c9e8dcc"
        }
      ],
      "requirements": [
        "TK-7",
        "STATE-3"
      ],
      "scope": "Single-sample RGBA8 Tk crops: byte/normalized-float32 alpha, resize, argument rejection/retry",
      "excluded": [
        "Other crops/target dimensions/formats, RGB-only capture, multisampling and general readback interfaces.",
        "Device-loss recovery, OS scaling, arbitrary host/root ownership and other backend/lifecycle behavior.",
        "Full parent read_pixels, backend and context obligations remain unchanged."
      ],
      "owner": "native"
    }
  ],
  "pairs": [
    {
      "feature": "tk.readback.crop-formats",
      "profile": "windows-gpu-tk86-cp312-development",
      "dependencies": [],
      "applied_to_ledger": false
    },
    {
      "feature": "tk.readback.crop-formats",
      "profile": "wsl-software-tk90-cp31213-development",
      "dependencies": [],
      "applied_to_ledger": false
    }
  ],
  "workflows": [
    {
      "id": "tk-capture-formats",
      "script": {
        "path": "tools/tkinter_capture_scenario.py",
        "sha256": "bcce154942b072eaf4d192687ae3afd43c973b3cfd535ab22310cee58ddc7888"
      },
      "profiles": [
        "windows-gpu-tk86-cp312-development",
        "wsl-software-tk90-cp31213-development"
      ],
      "features": [
        "tk.readback.crop-formats"
      ],
      "modes": [
        "embedded"
      ],
      "launch": [
        "{consumer_python}",
        "tools/tkinter_capture_scenario.py"
      ],
      "acceptance": [
        {
          "kind": "ordinary",
          "nodeid": "tests/native/test_tkinter_capture_scenario.py::test_real_tk_capture_observer_scenario",
          "cases": 1,
          "expected": "Independent RGBA8 byte and normalized-float32 crop(3,4,131,69) on257x129 target preserves orientation/alpha and every pixel.",
          "source": {
            "path": "tests/native/test_tkinter_capture_scenario.py",
            "sha256": "a06eb870b25fe0b814facfd10bfed50db9a43f645873a2eb54a80080a632ab55"
          }
        },
        {
          "kind": "mutation",
          "nodeid": "tests/native/test_tkinter_capture_scenario.py::test_real_tk_capture_observer_scenario",
          "cases": 1,
          "expected": "Resize to301x177 then crop(5,7,157,97), crossing both quadrant boundaries, with independently expected byte/float values.",
          "source": {
            "path": "tests/native/test_tkinter_capture_scenario.py",
            "sha256": "a06eb870b25fe0b814facfd10bfed50db9a43f645873a2eb54a80080a632ab55"
          }
        },
        {
          "kind": "failure",
          "nodeid": "tests/native/test_tkinter_capture_scenario.py::test_real_tk_capture_observer_scenario",
          "cases": 1,
          "expected": "Malformed three-component viewport raises original ValueError without submit/finish/wait/present or consuming real pending clear work.",
          "source": {
            "path": "tests/native/test_tkinter_capture_scenario.py",
            "sha256": "a06eb870b25fe0b814facfd10bfed50db9a43f645873a2eb54a80080a632ab55"
          }
        },
        {
          "kind": "recovery",
          "nodeid": "tests/native/test_tkinter_capture_scenario.py::test_real_tk_capture_observer_scenario",
          "cases": 1,
          "expected": "Valid cropped byte/float retry consumes that exact retained cyan-alpha clear without an intervening repaint or presentation.",
          "source": {
            "path": "tests/native/test_tkinter_capture_scenario.py",
            "sha256": "a06eb870b25fe0b814facfd10bfed50db9a43f645873a2eb54a80080a632ab55"
          }
        }
      ],
      "expected": "All four finite modes assert in the same self-contained actual Tk/current-target workflow. Original installed/member/absence/control/shutdown gates remain required.",
      "observer": [
        "{controller_python}",
        "tools/audit_no_opengl.py",
        "run",
        "--python",
        "{consumer_python}",
        "--wheel",
        "{wheel}",
        "--scenario",
        "script",
        "--script",
        "tools/tkinter_capture_scenario.py",
        "--workflow-id",
        "tk-capture-formats",
        "--covered-feature",
        "tk.readback.crop-formats",
        "--dependencies-report",
        "{dependency_report}",
        "--policy",
        "deny",
        "--output",
        "{evidence_dir}/tk-capture-formats.json"
      ]
    }
  ],
  "reviews": {
    "source": null,
    "scope": null
  },
  "blockers": [
    "Source implementation is reviewed; candidate-bound source/scope/native-reuse approval remains pending.",
    "The self-contained setup has no imported dependency receipt; independent scope review must accept this closure or require additional local rows.",
    "Exact existing wheels must receive fresh same-child installed observation/control/shutdown evidence for this new workflow.",
    "All142 original required parent obligations and historical14-host matrix remain unchanged and incomplete.",
    "New current-head23-job CI, detached promotion review and strict eight-binding admission remain pending."
  ],
  "release_status": "NOT_QUALIFIED",
  "preparation_tools": [
    {
      "path": "tools/compatibility_candidate.py",
      "sha256": "4720d832e863b2cce517b5e32b149e640e472355a5ce8a0600250bcdd57143d5"
    },
    {
      "path": "tools/compatibility_inventory.py",
      "sha256": "3a8d4cc83f3c59a8e75578977f3cfd85b6b4d1714c2f898cb2d2844e4759346d"
    },
    {
      "path": "tools/compatibility_conservation.py",
      "sha256": "def99e8cb4053ee3d3c3b635ae5191abc4f1b1769d7de4eac61f738921f308b7"
    },
    {
      "path": "tools/compatibility_evidence.py",
      "sha256": "6d8257afdbaec44432a179878dd5f1eb0957b19f7ea7ef49717c0f8c25a80481"
    },
    {
      "path": "tools/compatibility_coverage.py",
      "sha256": "b13d3f12661b010d092306e7b4584ec1964ded91dd3a7ea007bd7663cda73831"
    },
    {
      "path": "compat/vispy-coverage.schema.json",
      "sha256": "2195ab0d7102eda01ecf40bfbe9aa5b1b32f39483ce9fe00cd88b3aca2394d50"
    },
    {
      "path": "tools/compatibility_execution.py",
      "sha256": "4b90a052b21a41db375cbaa550a790bfea370e9219bfc8078a91381c8e429bb9"
    },
    {
      "path": "compat/vispy-execution.schema.json",
      "sha256": "c4b20847c483a530b37c76aeec4e4ab057b5336e33cbfd15bdb0b17e4b0fd17b"
    },
    {
      "path": "tools/compatibility_qualification.py",
      "sha256": "9782bbbe35ba26700001c66c5c030f6d6e90652dfeb894cf1f515cbf3a87aa6d"
    },
    {
      "path": "compat/vispy-admission-selection.schema.json",
      "sha256": "fba1dc14d08c20c40159636ca10cf524d3a0ffd32725c16c4f389569c08645cf"
    },
    {
      "path": "tools/qualification_ci.py",
      "sha256": "d16bc66a51e8381296e77e2c3bea6e63a2ffa186bb38fd2f7f51c80e41437cc0"
    },
    {
      "path": "compat/qualification-ci.schema.json",
      "sha256": "ebb3a28deae29cd4634bac5d66174febe5f074eada4b50b53960851e5c7e700b"
    },
    {
      "path": "compat/qualification-ci.json",